id,tags
1,dog, gaming, hiking
2,pets, chess, camping, coding
3,birdwatching reading skydiving fishing surfing
4,pottery hiking surfing traveling
5,meditating photography camping hiking
6,reading coding gardening rockclimbing birdwatching knitting pottery rafting dancing yoga
7,cooking sculpting yoga pottery
8,coding knitting surfing volunteering gaming skydiving gardening
9,pottery skydiving gardening
10,yoga painting volunteering hiking cooking running
11,gardening surfing reading painting
12,yoga singing swimming gaming skateboarding
13,skydiving camping surfing meditating singing running
14,rafting photography painting writing gardening running
15,yoga photography rockclimbing knitting reading hiking surfing
16,skydiving camping swimming photography running gaming
17,reading coding hiking swimming running skateboarding biking yoga photography surfing traveling
18,swimming singing camping hiking
19,meditating knitting yoga biking
20,yoga reading coding
21,gaming coding dancing birdwatching traveling running meditating pottery knitting skydiving camping sculpting
22,photography playing traveling cooking camping rockclimbing
23,pottery hiking surfing traveling
24,skydiving reading rockclimbing volunteering painting playing fishing cooking birdwatching yoga dancing traveling
25,pottery dancing volunteering gardening rockclimbing skateboarding yoga swimming traveling cooking
26,rockclimbing skydiving volunteering gaming
27,volunteering birdwatching biking
28,yoga fishing birdwatching rafting skydiving
29,sculpting dancing volunteering writing camping gardening biking hiking photography singing running
30,volunteering running hiking biking
